<!ELEMENT branches (branch+)>
<!ELEMENT branch (address, contact, opening_hours)>
<!ELEMENT address (#PCDATA)>
<!ELEMENT contact (#PCDATA)>
<!ELEMENT opening_hours (#PCDATA)>